{
  "_delivery_gate": {
    "eligible": false,
    "reason": "non_tracerfy_verified_phone"
  },
  "custom_fields": [
    {
      "insuredDatabaseId": null,
      "text": "SummitLeads Lead ID",
      "value": "ea9e3064-8b5a-4c82-a3a3-fda2b628fec1"
    },
    {
      "insuredDatabaseId": null,
      "text": "Winner Data FF ID",
      "value": "SLQ-2026-HARVEY_SCHONBRUN_AS_TRUSTEE-001"
    },
    {
      "insuredDatabaseId": null,
      "text": "Property County",
      "value": "flagler"
    },
    {
      "insuredDatabaseId": null,
      "text": "Parcel ID",
      "value": "07-11-31-7037-00080-0110"
    },
    {
      "insuredDatabaseId": null,
      "text": "Property Address (Full)",
      "value": "73LUTHER DR, PALM COAST, FL- 32137"
    },
    {
      "insuredDatabaseId": null,
      "text": "Year Built",
      "value": "2007"
    },
    {
      "insuredDatabaseId": null,
      "text": "Square Footage",
      "value": "1509"
    },
    {
      "insuredDatabaseId": null,
      "text": "Number of Buildings",
      "value": "1"
    },
    {
      "insuredDatabaseId": null,
      "text": "Construction Class",
      "value": "0"
    },
    {
      "insuredDatabaseId": null,
      "text": "DOR Use Code",
      "value": "001"
    },
    {
      "insuredDatabaseId": null,
      "text": "Just Value",
      "value": "215633.0"
    },
    {
      "insuredDatabaseId": null,
      "text": "Improved",
      "value": "True"
    },
    {
      "insuredDatabaseId": null,
      "text": "Occupancy Status",
      "value": "unknown"
    },
    {
      "insuredDatabaseId": null,
      "text": "Sale Type",
      "value": "foreclosure"
    },
    {
      "insuredDatabaseId": null,
      "text": "Auction Date",
      "value": "2026-08-14"
    },
    {
      "insuredDatabaseId": null,
      "text": "Case Number",
      "value": "2026 CA 000149"
    },
    {
      "insuredDatabaseId": null,
      "text": "Buyer Total Wins",
      "value": "1"
    },
    {
      "insuredDatabaseId": null,
      "text": "Buyer Total Deployed",
      "value": "177400.0"
    },
    {
      "insuredDatabaseId": null,
      "text": "Buyer Counties Active",
      "value": "[\"flagler\"]"
    },
    {
      "insuredDatabaseId": null,
      "text": "Is Repeat Investor",
      "value": "False"
    },
    {
      "insuredDatabaseId": null,
      "text": "Umbrella Quote Requested",
      "value": "False"
    },
    {
      "insuredDatabaseId": null,
      "text": "Flood If Indicated",
      "value": "True"
    },
    {
      "insuredDatabaseId": null,
      "text": "Flood Basis",
      "value": "INFERRED_coastal_county_heuristic"
    },
    {
      "insuredDatabaseId": null,
      "text": "Commercial BOP If Applicable",
      "value": "False"
    },
    {
      "insuredDatabaseId": null,
      "text": "Master Policy Conversation",
      "value": "False"
    },
    {
      "insuredDatabaseId": null,
      "text": "Must Quote",
      "value": "[\"dwelling_landlord\", \"flood_if_indicated\"]"
    },
    {
      "insuredDatabaseId": null,
      "text": "Readiness Score",
      "value": "83.3"
    },
    {
      "insuredDatabaseId": null,
      "text": "Missing Required Fields",
      "value": "[\"contact_phone\", \"sold_amount\"]"
    },
    {
      "insuredDatabaseId": null,
      "text": "Product Line",
      "value": "dwelling_landlord"
    },
    {
      "insuredDatabaseId": null,
      "text": "Consent Status",
      "value": "none"
    },
    {
      "insuredDatabaseId": null,
      "text": "DNC Scrubbed",
      "value": "False"
    },
    {
      "insuredDatabaseId": null,
      "text": "Outbound Lane",
      "value": "compliant_outbound"
    }
  ],
  "dedupe_key": "HARVEY SCHONBRUN AS TRUSTEE",
  "meta": {
    "ff_id": "SLQ-2026-HARVEY_SCHONBRUN_AS_TRUSTEE-001",
    "is_business": false,
    "lead_id": "ea9e3064-8b5a-4c82-a3a3-fda2b628fec1",
    "org_id": "032f4717-545f-4a18-b48b-28ea4257699d"
  },
  "prospect": {
    "active": true,
    "address_line_1": "73LUTHER DR",
    "city": "PALM COAST",
    "commercial_name": "",
    "email": "",
    "first_name": "HARVEY SCHONBRUN AS",
    "insuredType": 1,
    "last_name": "TRUSTEE",
    "phone_number": "",
    "referral_source": "SummitLeads: dwelling_landlord",
    "state": "FL",
    "type": 1,
    "zip_code": "32137"
  },
  "task": {
    "completion": 0,
    "description": "Hi HARVEY SCHONBRUN AS TRUSTEE, saw you picked up 73LUTHER DR, PALM COAST, FL- 32137 at the Flagler County foreclosure auction on 2026-08-14; we already pulled the property card (built 2007, 1509 sqft) so we can have a landlord/dwelling quote ready today.",
    "priority": "high",
    "status": "New",
    "title": "Quote-ready Winner Data lead: HARVEY SCHONBRUN AS TRUSTEE"
  }
}