{
  "_delivery_gate": {
    "eligible": false,
    "reason": "non_tracerfy_verified_phone"
  },
  "custom_fields": [
    {
      "insuredDatabaseId": null,
      "text": "SummitLeads Lead ID",
      "value": "6234a8c1-2fc8-4b8c-a9bb-933c7140bef7"
    },
    {
      "insuredDatabaseId": null,
      "text": "Winner Data FF ID",
      "value": "SLQ-2026-HUNTLEY_FC_HOLDINGS_LLC-001"
    },
    {
      "insuredDatabaseId": null,
      "text": "Property County",
      "value": "lee"
    },
    {
      "insuredDatabaseId": null,
      "text": "Parcel ID",
      "value": "26-45-22-02-00000.0080"
    },
    {
      "insuredDatabaseId": null,
      "text": "Property Address (Full)",
      "value": "3511 PINK IBIS DR, SAINT JAMES CITY, FL- 33956"
    },
    {
      "insuredDatabaseId": null,
      "text": "Occupancy Status",
      "value": "unknown"
    },
    {
      "insuredDatabaseId": null,
      "text": "Sale Type",
      "value": "foreclosure"
    },
    {
      "insuredDatabaseId": null,
      "text": "Auction Date",
      "value": "2026-08-13"
    },
    {
      "insuredDatabaseId": null,
      "text": "Case Number",
      "value": "25-CC-007464"
    },
    {
      "insuredDatabaseId": null,
      "text": "Is Repeat Investor",
      "value": "False"
    },
    {
      "insuredDatabaseId": null,
      "text": "Umbrella Quote Requested",
      "value": "False"
    },
    {
      "insuredDatabaseId": null,
      "text": "Flood If Indicated",
      "value": "True"
    },
    {
      "insuredDatabaseId": null,
      "text": "Flood Basis",
      "value": "INFERRED_coastal_county_heuristic"
    },
    {
      "insuredDatabaseId": null,
      "text": "Master Policy Conversation",
      "value": "False"
    },
    {
      "insuredDatabaseId": null,
      "text": "Must Quote",
      "value": "[\"dwelling_landlord\", \"flood_if_indicated\"]"
    },
    {
      "insuredDatabaseId": null,
      "text": "Readiness Score",
      "value": "41.7"
    },
    {
      "insuredDatabaseId": null,
      "text": "Missing Required Fields",
      "value": "[\"contact_phone\", \"year_built\", \"sqft\", \"num_buildings\", \"construction_class\", \"dor_use_code\", \"sold_amount\"]"
    },
    {
      "insuredDatabaseId": null,
      "text": "Product Line",
      "value": "dwelling_landlord"
    },
    {
      "insuredDatabaseId": null,
      "text": "Consent Status",
      "value": "none"
    },
    {
      "insuredDatabaseId": null,
      "text": "DNC Scrubbed",
      "value": "False"
    },
    {
      "insuredDatabaseId": null,
      "text": "Outbound Lane",
      "value": "compliant_outbound"
    }
  ],
  "dedupe_key": "HUNTLEY FC HOLDINGS LLC",
  "meta": {
    "ff_id": "SLQ-2026-HUNTLEY_FC_HOLDINGS_LLC-001",
    "is_business": true,
    "lead_id": "6234a8c1-2fc8-4b8c-a9bb-933c7140bef7",
    "org_id": "032f4717-545f-4a18-b48b-28ea4257699d"
  },
  "prospect": {
    "active": true,
    "address_line_1": "3511 PINK IBIS DR",
    "city": "SAINT JAMES CITY",
    "commercial_name": "HUNTLEY FC HOLDINGS LLC",
    "email": "",
    "first_name": "",
    "insuredType": 2,
    "last_name": "",
    "phone_number": "",
    "referral_source": "SummitLeads: dwelling_landlord",
    "state": "FL",
    "type": 2,
    "zip_code": "33956"
  },
  "task": {
    "completion": 0,
    "description": "Hi HUNTLEY FC HOLDINGS LLC, saw you picked up 3511 PINK IBIS DR, SAINT JAMES CITY, FL- 33956 at the Lee County foreclosure auction on 2026-08-13.",
    "priority": "medium",
    "status": "New",
    "title": "Quote-ready Winner Data lead: HUNTLEY FC HOLDINGS LLC"
  }
}