{
  "_delivery_gate": {
    "eligible": false,
    "reason": "non_tracerfy_verified_phone"
  },
  "custom_fields": [
    {
      "insuredDatabaseId": null,
      "text": "SummitLeads Lead ID",
      "value": "81bf0446-3291-4140-9b1f-03463bf69fc7"
    },
    {
      "insuredDatabaseId": null,
      "text": "Winner Data FF ID",
      "value": "SLQ-2026-DANIEL_VARGO_LLC-001"
    },
    {
      "insuredDatabaseId": null,
      "text": "Property County",
      "value": "broward"
    },
    {
      "insuredDatabaseId": null,
      "text": "Parcel ID",
      "value": "494231070060"
    },
    {
      "insuredDatabaseId": null,
      "text": "Property Address (Full)",
      "value": "1400 NW 32 AVE, LAUDERHILL, 33311"
    },
    {
      "insuredDatabaseId": null,
      "text": "Year Built",
      "value": "1964"
    },
    {
      "insuredDatabaseId": null,
      "text": "Square Footage",
      "value": "1877"
    },
    {
      "insuredDatabaseId": null,
      "text": "Number of Buildings",
      "value": "1"
    },
    {
      "insuredDatabaseId": null,
      "text": "Construction Class",
      "value": "2"
    },
    {
      "insuredDatabaseId": null,
      "text": "DOR Use Code",
      "value": "001"
    },
    {
      "insuredDatabaseId": null,
      "text": "Just Value",
      "value": "79310.0"
    },
    {
      "insuredDatabaseId": null,
      "text": "Improved",
      "value": "True"
    },
    {
      "insuredDatabaseId": null,
      "text": "Occupancy Status",
      "value": "unknown"
    },
    {
      "insuredDatabaseId": null,
      "text": "Sale Type",
      "value": "foreclosure"
    },
    {
      "insuredDatabaseId": null,
      "text": "Auction Date",
      "value": "2026-08-13"
    },
    {
      "insuredDatabaseId": null,
      "text": "Case Number",
      "value": "CACE-19-008235"
    },
    {
      "insuredDatabaseId": null,
      "text": "Buyer Total Wins",
      "value": "1"
    },
    {
      "insuredDatabaseId": null,
      "text": "Buyer Total Deployed",
      "value": "150100.0"
    },
    {
      "insuredDatabaseId": null,
      "text": "Buyer Counties Active",
      "value": "[\"broward\"]"
    },
    {
      "insuredDatabaseId": null,
      "text": "Is Repeat Investor",
      "value": "False"
    },
    {
      "insuredDatabaseId": null,
      "text": "Umbrella Quote Requested",
      "value": "False"
    },
    {
      "insuredDatabaseId": null,
      "text": "Flood If Indicated",
      "value": "True"
    },
    {
      "insuredDatabaseId": null,
      "text": "Flood Basis",
      "value": "INFERRED_coastal_county_heuristic"
    },
    {
      "insuredDatabaseId": null,
      "text": "Commercial BOP If Applicable",
      "value": "False"
    },
    {
      "insuredDatabaseId": null,
      "text": "Master Policy Conversation",
      "value": "False"
    },
    {
      "insuredDatabaseId": null,
      "text": "Must Quote",
      "value": "[\"dwelling_landlord\", \"flood_if_indicated\"]"
    },
    {
      "insuredDatabaseId": null,
      "text": "Readiness Score",
      "value": "83.3"
    },
    {
      "insuredDatabaseId": null,
      "text": "Missing Required Fields",
      "value": "[\"contact_phone\", \"sold_amount\"]"
    },
    {
      "insuredDatabaseId": null,
      "text": "Product Line",
      "value": "dwelling_landlord"
    },
    {
      "insuredDatabaseId": null,
      "text": "Consent Status",
      "value": "none"
    },
    {
      "insuredDatabaseId": null,
      "text": "DNC Scrubbed",
      "value": "False"
    },
    {
      "insuredDatabaseId": null,
      "text": "Outbound Lane",
      "value": "compliant_outbound"
    }
  ],
  "dedupe_key": "DANIEL VARGO LLC",
  "meta": {
    "ff_id": "SLQ-2026-DANIEL_VARGO_LLC-001",
    "is_business": true,
    "lead_id": "81bf0446-3291-4140-9b1f-03463bf69fc7",
    "org_id": "032f4717-545f-4a18-b48b-28ea4257699d"
  },
  "prospect": {
    "active": true,
    "address_line_1": "1400 NW 32 AVE",
    "city": "LAUDERHILL",
    "commercial_name": "DANIEL VARGO LLC",
    "email": "",
    "first_name": "",
    "insuredType": 2,
    "last_name": "",
    "phone_number": "",
    "referral_source": "SummitLeads: dwelling_landlord",
    "state": "FL",
    "type": 2,
    "zip_code": "33311"
  },
  "task": {
    "completion": 0,
    "description": "Hi DANIEL VARGO LLC, saw you picked up 1400 NW 32 AVE, LAUDERHILL, 33311 at the Broward County foreclosure auction on 2026-08-13; we already pulled the property card (built 1964, 1877 sqft) so we can have a landlord/dwelling quote ready today.",
    "priority": "high",
    "status": "New",
    "title": "Quote-ready Winner Data lead: DANIEL VARGO LLC"
  }
}