{
  "_delivery_gate": {
    "eligible": false,
    "reason": "non_tracerfy_verified_phone"
  },
  "custom_fields": [
    {
      "insuredDatabaseId": null,
      "text": "SummitLeads Lead ID",
      "value": "d34ee85d-5981-43b8-ba21-1588a74ad3bc"
    },
    {
      "insuredDatabaseId": null,
      "text": "Winner Data FF ID",
      "value": "SLQ-2026-GENFI_MINISTRIES_INCORPORATED-001"
    },
    {
      "insuredDatabaseId": null,
      "text": "Property County",
      "value": "alachua"
    },
    {
      "insuredDatabaseId": null,
      "text": "Parcel ID",
      "value": "09755-000-000"
    },
    {
      "insuredDatabaseId": null,
      "text": "Property Address (Full)",
      "value": "404 NW 14TH AVE, GAINESVILLE, FL 32601"
    },
    {
      "insuredDatabaseId": null,
      "text": "Year Built",
      "value": "1900"
    },
    {
      "insuredDatabaseId": null,
      "text": "Square Footage",
      "value": "43262"
    },
    {
      "insuredDatabaseId": null,
      "text": "Number of Buildings",
      "value": "8"
    },
    {
      "insuredDatabaseId": null,
      "text": "Construction Class",
      "value": "0"
    },
    {
      "insuredDatabaseId": null,
      "text": "DOR Use Code",
      "value": "071"
    },
    {
      "insuredDatabaseId": null,
      "text": "Just Value",
      "value": "2583490.0"
    },
    {
      "insuredDatabaseId": null,
      "text": "Improved",
      "value": "True"
    },
    {
      "insuredDatabaseId": null,
      "text": "Occupancy Status",
      "value": "unknown"
    },
    {
      "insuredDatabaseId": null,
      "text": "Sale Type",
      "value": "foreclosure"
    },
    {
      "insuredDatabaseId": null,
      "text": "Auction Date",
      "value": "2026-08-13"
    },
    {
      "insuredDatabaseId": null,
      "text": "Case Number",
      "value": "01 2025 CA 003156"
    },
    {
      "insuredDatabaseId": null,
      "text": "Is Repeat Investor",
      "value": "False"
    },
    {
      "insuredDatabaseId": null,
      "text": "Umbrella Quote Requested",
      "value": "False"
    },
    {
      "insuredDatabaseId": null,
      "text": "Flood If Indicated",
      "value": "False"
    },
    {
      "insuredDatabaseId": null,
      "text": "Flood Basis",
      "value": "INFERRED_coastal_county_heuristic"
    },
    {
      "insuredDatabaseId": null,
      "text": "Commercial BOP If Applicable",
      "value": "True"
    },
    {
      "insuredDatabaseId": null,
      "text": "Master Policy Conversation",
      "value": "False"
    },
    {
      "insuredDatabaseId": null,
      "text": "Must Quote",
      "value": "[\"commercial_bop\"]"
    },
    {
      "insuredDatabaseId": null,
      "text": "Readiness Score",
      "value": "83.3"
    },
    {
      "insuredDatabaseId": null,
      "text": "Missing Required Fields",
      "value": "[\"contact_phone\", \"sold_amount\"]"
    },
    {
      "insuredDatabaseId": null,
      "text": "Product Line",
      "value": "commercial_bop"
    },
    {
      "insuredDatabaseId": null,
      "text": "Consent Status",
      "value": "none"
    },
    {
      "insuredDatabaseId": null,
      "text": "DNC Scrubbed",
      "value": "False"
    },
    {
      "insuredDatabaseId": null,
      "text": "Outbound Lane",
      "value": "compliant_outbound"
    }
  ],
  "dedupe_key": "GENFI MINISTRIES INCORPORATED",
  "meta": {
    "ff_id": "SLQ-2026-GENFI_MINISTRIES_INCORPORATED-001",
    "is_business": false,
    "lead_id": "d34ee85d-5981-43b8-ba21-1588a74ad3bc",
    "org_id": "032f4717-545f-4a18-b48b-28ea4257699d"
  },
  "prospect": {
    "active": true,
    "address_line_1": "404 NW 14TH AVE",
    "city": "GAINESVILLE",
    "commercial_name": "",
    "email": "",
    "first_name": "GENFI MINISTRIES",
    "insuredType": 1,
    "last_name": "INCORPORATED",
    "phone_number": "",
    "referral_source": "SummitLeads: commercial_bop",
    "state": "FL",
    "type": 1,
    "zip_code": "32601"
  },
  "task": {
    "completion": 0,
    "description": "Hi GENFI MINISTRIES INCORPORATED, saw you picked up 404 NW 14TH AVE, GAINESVILLE, FL 32601 at the Alachua County foreclosure auction on 2026-08-13; we already pulled the property card (built 1900, 43262 sqft) so we can have a landlord/dwelling quote ready today.",
    "priority": "high",
    "status": "New",
    "title": "Quote-ready Winner Data lead: GENFI MINISTRIES INCORPORATED"
  }
}