{
  "_delivery_gate": {
    "eligible": false,
    "reason": "non_tracerfy_verified_phone"
  },
  "custom_fields": [
    {
      "insuredDatabaseId": null,
      "text": "SummitLeads Lead ID",
      "value": "83dd8ae5-15bb-4c89-a57d-fee60d71778f"
    },
    {
      "insuredDatabaseId": null,
      "text": "Winner Data FF ID",
      "value": "SLQ-2026-L_A_360_INVESTMENT_LLC-001"
    },
    {
      "insuredDatabaseId": null,
      "text": "Property County",
      "value": "marion"
    },
    {
      "insuredDatabaseId": null,
      "text": "Parcel ID",
      "value": "1148456"
    },
    {
      "insuredDatabaseId": null,
      "text": "Property Address (Full)",
      "value": "9777 SE 163RD ST, SUMMERFIELD, FL- 34491"
    },
    {
      "insuredDatabaseId": null,
      "text": "Occupancy Status",
      "value": "unknown"
    },
    {
      "insuredDatabaseId": null,
      "text": "Sale Type",
      "value": "foreclosure"
    },
    {
      "insuredDatabaseId": null,
      "text": "Auction Date",
      "value": "2026-08-11"
    },
    {
      "insuredDatabaseId": null,
      "text": "Case Number",
      "value": "422026CC000273CCAXMX"
    },
    {
      "insuredDatabaseId": null,
      "text": "Buyer Total Wins",
      "value": "1"
    },
    {
      "insuredDatabaseId": null,
      "text": "Buyer Total Deployed",
      "value": "30001.0"
    },
    {
      "insuredDatabaseId": null,
      "text": "Buyer Counties Active",
      "value": "[\"marion\"]"
    },
    {
      "insuredDatabaseId": null,
      "text": "Is Repeat Investor",
      "value": "False"
    },
    {
      "insuredDatabaseId": null,
      "text": "Umbrella Quote Requested",
      "value": "False"
    },
    {
      "insuredDatabaseId": null,
      "text": "Flood If Indicated",
      "value": "False"
    },
    {
      "insuredDatabaseId": null,
      "text": "Flood Basis",
      "value": "INFERRED_coastal_county_heuristic"
    },
    {
      "insuredDatabaseId": null,
      "text": "Master Policy Conversation",
      "value": "False"
    },
    {
      "insuredDatabaseId": null,
      "text": "Must Quote",
      "value": "[\"dwelling_landlord\"]"
    },
    {
      "insuredDatabaseId": null,
      "text": "Readiness Score",
      "value": "41.7"
    },
    {
      "insuredDatabaseId": null,
      "text": "Missing Required Fields",
      "value": "[\"contact_phone\", \"year_built\", \"sqft\", \"num_buildings\", \"construction_class\", \"dor_use_code\", \"sold_amount\"]"
    },
    {
      "insuredDatabaseId": null,
      "text": "Product Line",
      "value": "dwelling_landlord"
    },
    {
      "insuredDatabaseId": null,
      "text": "Consent Status",
      "value": "none"
    },
    {
      "insuredDatabaseId": null,
      "text": "DNC Scrubbed",
      "value": "False"
    },
    {
      "insuredDatabaseId": null,
      "text": "Outbound Lane",
      "value": "compliant_outbound"
    }
  ],
  "dedupe_key": "LA 360 INVESTMENT LLC",
  "meta": {
    "ff_id": "SLQ-2026-L_A_360_INVESTMENT_LLC-001",
    "is_business": true,
    "lead_id": "83dd8ae5-15bb-4c89-a57d-fee60d71778f",
    "org_id": "032f4717-545f-4a18-b48b-28ea4257699d"
  },
  "prospect": {
    "active": true,
    "address_line_1": "9777 SE 163RD ST",
    "city": "SUMMERFIELD",
    "commercial_name": "L.A. 360 INVESTMENT, LLC",
    "email": "",
    "first_name": "",
    "insuredType": 2,
    "last_name": "",
    "phone_number": "",
    "referral_source": "SummitLeads: dwelling_landlord",
    "state": "FL",
    "type": 2,
    "zip_code": "34491"
  },
  "task": {
    "completion": 0,
    "description": "Hi L.A. 360 INVESTMENT, LLC, saw you picked up 9777 SE 163RD ST, SUMMERFIELD, FL- 34491 at the Marion County foreclosure auction on 2026-08-11.",
    "priority": "medium",
    "status": "New",
    "title": "Quote-ready Winner Data lead: L.A. 360 INVESTMENT, LLC"
  }
}