{
  "_delivery_gate": {
    "eligible": false,
    "reason": "non_tracerfy_verified_phone"
  },
  "custom_fields": [
    {
      "insuredDatabaseId": null,
      "text": "Winner Data Lead ID",
      "value": "9fee6efb-1399-4f72-ab88-ab0077148853"
    },
    {
      "insuredDatabaseId": null,
      "text": "Winner Data FF ID",
      "value": "SLQ-2026-ROBERT_BARTHO_CUSTODIAL_IRA_AMERICAN_EST-001"
    },
    {
      "insuredDatabaseId": null,
      "text": "Property County",
      "value": "lee"
    },
    {
      "insuredDatabaseId": null,
      "text": "Parcel ID",
      "value": "27-44-23-C3-00700.0200"
    },
    {
      "insuredDatabaseId": null,
      "text": "Property Address (Full)",
      "value": "917 PALMETTO POINTE CIR, CAPE CORAL, FL- 33991"
    },
    {
      "insuredDatabaseId": null,
      "text": "Occupancy Status",
      "value": "unknown"
    },
    {
      "insuredDatabaseId": null,
      "text": "Sale Type",
      "value": "foreclosure"
    },
    {
      "insuredDatabaseId": null,
      "text": "Sold Amount",
      "value": "40100.0"
    },
    {
      "insuredDatabaseId": null,
      "text": "Auction Date",
      "value": "2026-03-12"
    },
    {
      "insuredDatabaseId": null,
      "text": "Case Number",
      "value": "24-CA-008044"
    },
    {
      "insuredDatabaseId": null,
      "text": "Is Repeat Investor",
      "value": "False"
    },
    {
      "insuredDatabaseId": null,
      "text": "Umbrella Quote Requested",
      "value": "False"
    },
    {
      "insuredDatabaseId": null,
      "text": "Flood If Indicated",
      "value": "True"
    },
    {
      "insuredDatabaseId": null,
      "text": "Flood Basis",
      "value": "INFERRED_coastal_county_heuristic"
    },
    {
      "insuredDatabaseId": null,
      "text": "Master Policy Conversation",
      "value": "False"
    },
    {
      "insuredDatabaseId": null,
      "text": "Must Quote",
      "value": "[\"dwelling_landlord\", \"flood_if_indicated\"]"
    },
    {
      "insuredDatabaseId": null,
      "text": "Readiness Score",
      "value": "50.0"
    },
    {
      "insuredDatabaseId": null,
      "text": "Missing Required Fields",
      "value": "[\"contact_phone\", \"year_built\", \"sqft\", \"num_buildings\", \"construction_class\", \"dor_use_code\"]"
    },
    {
      "insuredDatabaseId": null,
      "text": "Product Line",
      "value": "dwelling_landlord"
    },
    {
      "insuredDatabaseId": null,
      "text": "Consent Status",
      "value": "none"
    },
    {
      "insuredDatabaseId": null,
      "text": "DNC Scrubbed",
      "value": "False"
    },
    {
      "insuredDatabaseId": null,
      "text": "Outbound Lane",
      "value": "compliant_outbound"
    }
  ],
  "dedupe_key": "ROBERT BARTHO CUSTODIAL IRA AMERICAN ESTATE  TRUST",
  "meta": {
    "ff_id": "SLQ-2026-ROBERT_BARTHO_CUSTODIAL_IRA_AMERICAN_EST-001",
    "is_business": true,
    "lead_id": "9fee6efb-1399-4f72-ab88-ab0077148853",
    "org_id": "032f4717-545f-4a18-b48b-28ea4257699d"
  },
  "prospect": {
    "active": true,
    "address_line_1": "917 PALMETTO POINTE CIR",
    "city": "CAPE CORAL",
    "commercial_name": "ROBERT BARTHO (CUSTODIAL IRA, AMERICAN ESTATE & TRUST)",
    "email": "",
    "first_name": "",
    "insuredType": 2,
    "last_name": "",
    "phone_number": "",
    "referral_source": "Winner Data: dwelling_landlord",
    "state": "FL",
    "type": 2,
    "zip_code": "33991"
  },
  "task": {
    "completion": 0,
    "description": "Hi ROBERT BARTHO (CUSTODIAL IRA, AMERICAN ESTATE & TRUST), saw you picked up 917 PALMETTO POINTE CIR, CAPE CORAL, FL- 33991 at the Lee County foreclosure auction on 2026-03-12 for $40100.00.",
    "priority": "medium",
    "status": "New",
    "title": "Quote-ready Winner Data lead: ROBERT BARTHO (CUSTODIAL IRA, AMERICAN ESTATE & TRUST)"
  }
}