{
  "_delivery_gate": {
    "eligible": false,
    "reason": "non_tracerfy_verified_phone"
  },
  "custom_fields": [
    {
      "insuredDatabaseId": null,
      "text": "Winner Data Lead ID",
      "value": "6bc71e24-fd2c-455b-9523-e78e173ec53b"
    },
    {
      "insuredDatabaseId": null,
      "text": "Winner Data FF ID",
      "value": "SLQ-2026-JUPI_LLC-001"
    },
    {
      "insuredDatabaseId": null,
      "text": "Property County",
      "value": "lee"
    },
    {
      "insuredDatabaseId": null,
      "text": "Parcel ID",
      "value": "32-43-23-C2-06133.0180"
    },
    {
      "insuredDatabaseId": null,
      "text": "Property Address (Full)",
      "value": "2608 NW 21ST TER, CAPE CORAL, FL- 33993"
    },
    {
      "insuredDatabaseId": null,
      "text": "Occupancy Status",
      "value": "unknown"
    },
    {
      "insuredDatabaseId": null,
      "text": "Sale Type",
      "value": "foreclosure"
    },
    {
      "insuredDatabaseId": null,
      "text": "Auction Date",
      "value": "2026-08-06"
    },
    {
      "insuredDatabaseId": null,
      "text": "Case Number",
      "value": "25-CA-004220"
    },
    {
      "insuredDatabaseId": null,
      "text": "Buyer Total Wins",
      "value": "1"
    },
    {
      "insuredDatabaseId": null,
      "text": "Buyer Total Deployed",
      "value": "100.0"
    },
    {
      "insuredDatabaseId": null,
      "text": "Buyer Counties Active",
      "value": "[\"lee\"]"
    },
    {
      "insuredDatabaseId": null,
      "text": "Is Repeat Investor",
      "value": "False"
    },
    {
      "insuredDatabaseId": null,
      "text": "Umbrella Quote Requested",
      "value": "False"
    },
    {
      "insuredDatabaseId": null,
      "text": "Flood If Indicated",
      "value": "True"
    },
    {
      "insuredDatabaseId": null,
      "text": "Flood Basis",
      "value": "INFERRED_coastal_county_heuristic"
    },
    {
      "insuredDatabaseId": null,
      "text": "Master Policy Conversation",
      "value": "False"
    },
    {
      "insuredDatabaseId": null,
      "text": "Must Quote",
      "value": "[\"dwelling_landlord\", \"flood_if_indicated\"]"
    },
    {
      "insuredDatabaseId": null,
      "text": "Readiness Score",
      "value": "41.7"
    },
    {
      "insuredDatabaseId": null,
      "text": "Missing Required Fields",
      "value": "[\"contact_phone\", \"year_built\", \"sqft\", \"num_buildings\", \"construction_class\", \"dor_use_code\", \"sold_amount\"]"
    },
    {
      "insuredDatabaseId": null,
      "text": "Product Line",
      "value": "dwelling_landlord"
    },
    {
      "insuredDatabaseId": null,
      "text": "Consent Status",
      "value": "none"
    },
    {
      "insuredDatabaseId": null,
      "text": "DNC Scrubbed",
      "value": "False"
    },
    {
      "insuredDatabaseId": null,
      "text": "Outbound Lane",
      "value": "compliant_outbound"
    }
  ],
  "dedupe_key": "JUPI LLC",
  "meta": {
    "ff_id": "SLQ-2026-JUPI_LLC-001",
    "is_business": true,
    "lead_id": "6bc71e24-fd2c-455b-9523-e78e173ec53b",
    "org_id": "032f4717-545f-4a18-b48b-28ea4257699d"
  },
  "prospect": {
    "active": true,
    "address_line_1": "2608 NW 21ST TER",
    "city": "CAPE CORAL",
    "commercial_name": "JUPI LLC",
    "email": "",
    "first_name": "",
    "insuredType": 2,
    "last_name": "",
    "phone_number": "",
    "referral_source": "Winner Data: dwelling_landlord",
    "state": "FL",
    "type": 2,
    "zip_code": "33993"
  },
  "task": {
    "completion": 0,
    "description": "Hi JUPI LLC, saw you picked up 2608 NW 21ST TER, CAPE CORAL, FL- 33993 at the Lee County foreclosure auction on 2026-08-06.",
    "priority": "medium",
    "status": "New",
    "title": "Quote-ready Winner Data lead: JUPI LLC"
  }
}