{
  "_delivery_gate": {
    "eligible": false,
    "reason": "vacant_land"
  },
  "custom_fields": [
    {
      "insuredDatabaseId": null,
      "text": "Winner Data Lead ID",
      "value": "2fb21f42-209a-4b2f-9ea0-fab380ad5002"
    },
    {
      "insuredDatabaseId": null,
      "text": "Winner Data FF ID",
      "value": "SLQ-2026-HAMMOCK_REAL_ESTATE_DEVELOPMENT_LLC-001"
    },
    {
      "insuredDatabaseId": null,
      "text": "Property County",
      "value": "flagler"
    },
    {
      "insuredDatabaseId": null,
      "text": "Parcel ID",
      "value": "10-12-30-0850-01700-0040"
    },
    {
      "insuredDatabaseId": null,
      "text": "Property Address (Full)",
      "value": "BUNNELL, FL- 32110"
    },
    {
      "insuredDatabaseId": null,
      "text": "Year Built",
      "value": "0"
    },
    {
      "insuredDatabaseId": null,
      "text": "Square Footage",
      "value": "0"
    },
    {
      "insuredDatabaseId": null,
      "text": "Number of Buildings",
      "value": "0"
    },
    {
      "insuredDatabaseId": null,
      "text": "Construction Class",
      "value": "0"
    },
    {
      "insuredDatabaseId": null,
      "text": "DOR Use Code",
      "value": "010"
    },
    {
      "insuredDatabaseId": null,
      "text": "Just Value",
      "value": "59282.0"
    },
    {
      "insuredDatabaseId": null,
      "text": "Improved",
      "value": "False"
    },
    {
      "insuredDatabaseId": null,
      "text": "Occupancy Status",
      "value": "unknown"
    },
    {
      "insuredDatabaseId": null,
      "text": "Sale Type",
      "value": "foreclosure"
    },
    {
      "insuredDatabaseId": null,
      "text": "Auction Date",
      "value": "2026-08-07"
    },
    {
      "insuredDatabaseId": null,
      "text": "Case Number",
      "value": "2025 CA 000010"
    },
    {
      "insuredDatabaseId": null,
      "text": "Buyer Total Wins",
      "value": "1"
    },
    {
      "insuredDatabaseId": null,
      "text": "Buyer Total Deployed",
      "value": "100.0"
    },
    {
      "insuredDatabaseId": null,
      "text": "Buyer Counties Active",
      "value": "[\"flagler\"]"
    },
    {
      "insuredDatabaseId": null,
      "text": "Is Repeat Investor",
      "value": "False"
    },
    {
      "insuredDatabaseId": null,
      "text": "Umbrella Quote Requested",
      "value": "False"
    },
    {
      "insuredDatabaseId": null,
      "text": "Flood If Indicated",
      "value": "True"
    },
    {
      "insuredDatabaseId": null,
      "text": "Flood Basis",
      "value": "INFERRED_coastal_county_heuristic"
    },
    {
      "insuredDatabaseId": null,
      "text": "Commercial BOP If Applicable",
      "value": "True"
    },
    {
      "insuredDatabaseId": null,
      "text": "Master Policy Conversation",
      "value": "False"
    },
    {
      "insuredDatabaseId": null,
      "text": "Must Quote",
      "value": "[\"other\", \"flood_if_indicated\"]"
    },
    {
      "insuredDatabaseId": null,
      "text": "Readiness Score",
      "value": "83.3"
    },
    {
      "insuredDatabaseId": null,
      "text": "Missing Required Fields",
      "value": "[\"contact_phone\", \"sold_amount\"]"
    },
    {
      "insuredDatabaseId": null,
      "text": "Product Line",
      "value": "other"
    },
    {
      "insuredDatabaseId": null,
      "text": "Consent Status",
      "value": "none"
    },
    {
      "insuredDatabaseId": null,
      "text": "DNC Scrubbed",
      "value": "False"
    },
    {
      "insuredDatabaseId": null,
      "text": "Outbound Lane",
      "value": "compliant_outbound"
    }
  ],
  "dedupe_key": "HAMMOCK REAL ESTATE DEVELOPMENT LLC",
  "meta": {
    "ff_id": "SLQ-2026-HAMMOCK_REAL_ESTATE_DEVELOPMENT_LLC-001",
    "is_business": true,
    "lead_id": "2fb21f42-209a-4b2f-9ea0-fab380ad5002",
    "org_id": "032f4717-545f-4a18-b48b-28ea4257699d"
  },
  "prospect": {
    "active": true,
    "address_line_1": "",
    "city": "BUNNELL",
    "commercial_name": "HAMMOCK REAL ESTATE DEVELOPMENT, LLC",
    "email": "",
    "first_name": "",
    "insuredType": 2,
    "last_name": "",
    "phone_number": "",
    "referral_source": "Winner Data: other",
    "state": "FL",
    "type": 2,
    "zip_code": "32110"
  },
  "task": {
    "completion": 0,
    "description": "Hi HAMMOCK REAL ESTATE DEVELOPMENT, LLC, saw you picked up BUNNELL, FL- 32110 at the Flagler County foreclosure auction on 2026-08-07; we already pulled the property card (built ?, 0 sqft) so we can have a landlord/dwelling quote ready today.",
    "priority": "high",
    "status": "New",
    "title": "Quote-ready Winner Data lead: HAMMOCK REAL ESTATE DEVELOPMENT, LLC"
  }
}